{
  "schema_version": 1,
  "run_id": "2026-09-17-example",
  "source_id": "authorized_example_source",
  "state": "ranked",
  "artifacts": {
    "authorization": "inputs/source-authorization.json",
    "research": "evidence/source-research.json",
    "transcript": "evidence/transcript.json",
    "candidates": "candidates/candidates.json",
    "selection": "selection/ranked-selection.json"
  },
  "blocked_reason": null,
  "history": [
    {"state": "initiated", "at": "2026-09-17T09:00:00-04:00", "actor": "run-controller"},
    {"state": "source_authorized", "at": "2026-09-17T09:01:00-04:00", "actor": "source-intake", "artifact": "inputs/source-authorization.json"},
    {"state": "ranked", "at": "2026-09-17T09:10:00-04:00", "actor": "short-video-editing-coach", "artifact": "selection/ranked-selection.json"}
  ]
}
